"TranscriptId","TranscriptText"
"1724606781233-6920","""Jason: Good morning! This is Jason from SecureHome Systems. Am I speaking with Karen? Karen: Yes, this is Karen. Good morning, Jason. Jason: Thank you for your interest in our home security solutions, Karen. How has your day been so far? Karen: It's been fine, thanks. Just a bit busy with work. Jason: I understand. I appreciate you taking the time to speak with me. May I ask what prompted your interest in home security? Karen: Well, there have been a few break-ins in our neighborhood recently. It's got me worried about the safety of my family. Jason: I'm sorry to hear about the break-ins, Karen. It's understandable that you're concerned. Home security is indeed crucial for protecting your family and property. Can you tell me a bit about your home? Is it a house or an apartment? Karen: It's a two-story house with a basement. We've been living here for about five years. Jason: Thank you for that information. A multi-story home can have unique security needs. Have you had any security systems installed before? Karen: No, we haven't. This would be our first. Jason: I see. Well, you've come to the right place. SecureHome Systems specializes in customized security solutions for homes just like yours. We offer a range of services from basic alarm systems to comprehensive smart home security integration. What specific concerns do you have about your home's security? Karen: I'm mainly worried about intruders, especially at night or when we're away on vacation. And I'd like to be able to check on the house when I'm not there. Jason: Those are common concerns, Karen, and we have excellent solutions for both. Our basic package includes door and window sensors, motion detectors, and a smart control panel. We also offer cameras with remote viewing capabilities through a smartphone app. Would you be interested in that level of monitoring? Karen: Yes, that sounds like what I'm looking for. How does the system work? Jason: Great question. Our system is designed to be user-friendly and effective. When armed, any unauthorized entry triggers an alarm, immediately notifying both you and our 24/7 monitoring center. The monitoring center can then verify the situation and dispatch police if necessary. With cameras, you can check live feeds or recorded footage anytime via our secure app. How does that sound to you? Karen: That sounds good. Is it complicated to use? Jason: Not at all, Karen. We pride ourselves on creating systems that are easy to use. The control panel has a simple touchscreen interface, and our app is very intuitive. Plus, we provide thorough training during installation and offer 24/7 technical support. Many of our customers find they become comfortable with the system within a day or two. Karen: That's reassuring. What about installation? How long does that take? Jason: For a house your size, installation typically takes about 4-6 hours. We handle everything, from placing sensors and cameras to setting up the control panel and ensuring everything is working correctly. We also work with you to determine the best placement for all devices. Do you have a preference for when the installation would take place? Karen: Weekends would be best for us. Do you work on Saturdays? Jason: Absolutely! We offer installation services seven days a week to accommodate our customers' schedules. Now, Karen, based on what you've told me about your home and security needs, I'd recommend our SecureHome Plus package. This includes door and window sensors, three motion detectors, two indoor cameras, one outdoor camera, and our smart control panel with mobile app access. The total cost for this package, including professional installation, would be $899, with a monthly monitoring fee of $39.99. How does that align with your budget? Karen: That's a bit more than I was expecting to spend. Do you have any more basic options? Jason: I completely understand, Karen. Security is an investment, but we want to ensure it fits your budget. We do have a more basic package that might suit your needs. Our SecureHome Essentials package includes door and window sensors, two motion detectors, and the smart control panel with mobile app access, but without cameras. This package is priced at $599 with installation, and the monthly monitoring fee is $29.99. Would that be more in line with what you had in mind? Karen: Yes, that sounds more reasonable. And I could always add cameras later if I wanted to, right? Jason: Absolutely! That's one of the great things about our system - it's easily expandable. You can start with the essentials and add components as your needs change or your budget allows. We can add cameras, smart door locks, or even smoke and carbon monoxide detectors in the future. Karen: That's good to know. Do you offer any kind of warranty? Jason: Yes, we do, Karen. All our equipment comes with a 3-year warranty, and we also offer a 30-day money-back guarantee. If you're not completely satisfied with your system within the first month, we'll remove it and refund your money, no questions asked. Additionally, our monthly monitoring agreement is contract-free, so you can cancel at any time without penalties. Karen: That's quite reassuring. I think I'd like to go ahead with the Essentials package. Jason: That's fantastic, Karen! I think you've made an excellent choice. The SecureHome Essentials package will provide robust protection for your home. Shall we go ahead and schedule the installation? I see we have availability this Saturday at 9 AM or 1 PM. Would either of those times work for you? Karen: Saturday at 1 PM would be perfect. Jason: Excellent! I'll schedule you for this Saturday at 1 PM. Our installation team will call you the day before to confirm. Now, regarding payment, we require a $200 deposit to secure your installation slot, with the balance due upon completion. Does that work for you? Karen: Yes, that's fine. How can I make the deposit? Jason: Great! I can take your deposit over the phone right now using a credit or debit card. Once that's done, I'll email you a confirmation of your order and installation appointment, along with some information to help you prepare for the installation. Do you have any other questions for me before we proceed with the deposit? Karen: I think you've covered everything, Jason. Thank you for being so thorough. Jason: It's my pleasure, Karen. We want you to feel completely comfortable with your decision. If any questions come up later, please don't hesitate to call us. Our customer service team is available 24/7. Shall we go ahead with the deposit now? Karen: Yes, let's do that. Jason: Perfect. I'll just need your credit card information... (The conversation concludes with Jason processing the deposit and providing final details about the installation process.)"""
"1724548638927-8775","""I'm Sebastian, the CEO and Founder of Rilla. We provide speech analytics for outside sales and service. Our focus is on analyzing conversations of door-to-door representatives, roofing reps, solar reps, and anyone who speaks face-to-face with customers. We use a mobile app to record customer conversations, which are then analyzed using AI to help improve sales techniques.\n\nThe idea for Rilla Voice came from a previous startup where we worked with major brands. We realized that 85% of sales and commerce still happens offline, with limited visibility into these interactions. Understanding what people think by analyzing what they say became the foundation for Rilla Voice.\n\nLet me give you an example using roofing sales. Our analytics revealed key differences between top performers and newer reps. Top performers focused on specific pain points like missing shingles and debris in about 80% of their conversations. This approach made them three to four times more likely to book an appointment compared to newer reps who used different pitching strategies.\n\nAnother crucial insight from our analytics is the importance of the talk ratio - how much the salesperson talks versus the customer. For door-to-door conversations, the ideal talk ratio is around 75-85% for the salesperson. However, for inspections or adjuster meetings, the ratio should decrease to about 50-60%, emphasizing the importance of listening in sales.\n\nAt Rilla Voice, we're committed to providing these valuable insights into offline sales interactions, helping companies improve their sales strategies and performance. Our goal is to bring visibility and data-driven decision making to the world of face-to-face sales, which has been largely overlooked by technology until now."""
"1724553431720-1144","""Sebastian here, Founder and CEO of Rilla and we build speech analytics to capture insights from the billions of conversations that happen in physical stores uh if you think of a retail sales associative fast food worker bank teller flight attendant these consumer-facing employees wear a microphone connected to their phone from there our ai listens and it captures uh these conversations um and what you'll see here is that it's separating the speakers dealing with the noise and then it comes up with these series of transcripts that we use special text to transcribe so that you see it very clearly and then you get to see a bunch of analytics that we capture with natural language processing and the problem that we are solving here is that for companies that sell and distributed products offline it's very very hard to capture data they have to use focus group surveys and a bunch of mystery shoppers and these roundabout ways of collecting data they're super expensive they have to spend millions of dollars to only get a very very little data and it's very inaccurate and very slow and with this you can empower your business with the millions and millions of conversations that your actual employees are having with actual customers in actual consumption environments um so with that uh i'll wrap it up and thank you guys for listening"""
"1724605494720-4557","""Hello, Mrs. Johnson. My name is Sarah from Hometown Realty. I saw that you were interested in selling your home and would like to learn more about you and how we can work together. Do you have a few minutes to discuss selling your home?\n\nMrs. Johnson: Oh, hello Sarah. Yes, I've been thinking about selling. I suppose I have a few minutes.\n\nSalesperson: Wonderful, thank you for your time. May I ask what's prompting you to consider selling at this time?\n\nMrs. Johnson: Well, we're empty nesters now, and this house feels too big for just the two of us.\n\nSalesperson: I completely understand. Many of our clients find themselves in similar situations. Have you given any thought to what kind of home you'd like to move into?\n\nMrs. Johnson: We're thinking maybe a condo or a smaller house, something with less maintenance.\n\nSalesperson: That's a great idea. Hometown Realty has a wide range of properties that might suit your needs. Before we dive into that, though, I'd love to learn more about your current home. How long have you lived there?\n\nMrs. Johnson: It's been about 25 years now.\n\nSalesperson: Wonderful, so you've really made it a home. In your time there, have you made any major renovations or upgrades?\n\nMrs. Johnson: Yes, we remodeled the kitchen about 5 years ago and put in new windows last year.\n\nSalesperson: Those are excellent selling points. Buyers love updated kitchens and energy-efficient windows. Mrs. Johnson, based on what you've told me, I believe we could put together a very attractive listing for your home. Would you be interested in having me come by for a free, no-obligation home valuation? I could give you a better idea of what your home might sell for in the current market.\n\nMrs. Johnson: That sounds helpful. When could you do that?\n\nSalesperson: I have some availability this week. How does Thursday afternoon around 2 PM work for you?\n\nMrs. Johnson: Thursday at 2 would be fine.\n\nSalesperson: Excellent, I'll put that in my calendar. Thank you so much for your time today, Mrs. Johnson. I'm looking forward to meeting you in person and helping you transition to the next chapter of your life. Is there anything else you'd like to know before we wrap up?\n\nMrs. Johnson: No, I think that covers it for now. Thank you, Sarah.\n\nSalesperson: You're very welcome. Have a great day, and I'll see you on Thursday!"""
"1724553658155-8107","""Chris started coding in college, not as a child like many founders. He initially planned to study biomedical engineering but switched to computer science after taking his first programming course as a sophomore. He found he loved being able to solve problems with just a laptop.\n\n    After college, Chris took a job at Morgan Stanley but quickly realized the corporate world wasn't for him. He regrets not taking more risks early in his career.\n\n    Chris co-founded Rilla Voice in late 2019. They are building conversation intelligence tools for field sales, using AI to analyze sales conversations and provide feedback. The company has grown rapidly, reaching over $10 million in annual recurring revenue by January 2024. Their goal is to reach $100 million ARR by January 2025.\n\n    When hiring, Chris looks for """"high slope"""" individuals - people who can learn and grow quickly. He cares more about someone's potential and ability to figure things out than their current knowledge. For startups, he says it's important to find people who can solve problems from first principles and adapt to rapidly changing environments.\n\n    Chris encourages aspiring founders and engineers to pursue side projects they're genuinely curious about. He believes following your interests and building things you find fun is the best way to learn and develop skills that will be valuable for startups."""
"1724554700440-4641","""Hi, Mr. Thompson. My name is Alex from Digital Boost Marketing. I noticed you weren't investing in social media marketing and wanted to ask you a few questions about why you've decided to stray away from this type of marketing and learn more about what you do and your challenges in reaching customers. Is now a good time to talk?\n\nMr. Thompson: Hi Alex. I have a few minutes now, I suppose.\n\nSalesperson: Great, thank you. First, could you tell me a bit about your business? What products or services do you offer?\n\nMr. Thompson: We're a local bakery specializing in artisanal breads and pastries.\n\nSalesperson: That sounds delicious! How long have you been in business?\n\nMr. Thompson: We've been around for about 10 years now.\n\nSalesperson: Congratulations on a decade of success! That's quite an achievement. Can you tell me about your current marketing efforts? How are you typically reaching your customers?\n\nMr. Thompson: Well, we mostly rely on word of mouth and some local print ads. We have a website, but it's pretty basic.\n\nSalesperson: I see. And how has that been working for you? Are you seeing the growth you'd like?\n\nMr. Thompson: It's been okay, but we've plateaued a bit lately. We'd like to attract more younger customers.\n\nSalesperson: That's exactly where social media marketing could help. Platforms like Instagram and Facebook are perfect for showcasing beautiful photos of your baked goods and connecting with younger demographics. May I ask why you haven't explored social media marketing yet?\n\nMr. Thompson: Honestly, it just seems overwhelming. We're not very tech-savvy here, and we're always so busy with the day-to-day operations.\n\nSalesperson: I completely understand. Many of our clients felt the same way before working with us. That's where we come in - we can handle all aspects of your social media presence, from setting up accounts to creating content and engaging with your audience. Would you be interested in hearing about how we've helped other local businesses like yours increase their customer base through social media?\n\nMr. Thompson: Well, I suppose it couldn't hurt to learn more.\n\nSalesperson: Great! Let me give you a quick example. We worked with a local coffee shop last year, and within six months of implementing a social media strategy, they saw a 30% increase in foot traffic, primarily from the under-35 demographic. We could potentially achieve similar results for your bakery. Would you like to schedule a free consultation where we can do a deep dive into your business goals and how we might be able to help you achieve them?\n\nMr. Thompson: That does sound interesting. When could we do that?\n\nSalesperson: I have some availability next week. How does Tuesday at 10 AM sound? We could do it via video call or in person at your bakery, whichever you prefer.\n\nMr. Thompson: Tuesday at 10 works. Let's do it at the bakery.\n\nSalesperson: Perfect! I'm looking forward to meeting you and seeing your bakery. Before we wrap up, do you have any questions for me?\n\nMr. Thompson: Not right now, thanks.\n\nSalesperson: Alright, thank you for your time today, Mr. Thompson. I'll send you a calendar invite for Tuesday at 10 AM. Have a great day, and I'm excited to help your bakery reach new customers!"""
"1724554710192-6658","""Good afternoon, this is Emily from CloudTech Solutions. Am I speaking with Ms. Davis?\n\nMs. Davis: Yes, this is Sarah Davis.\n\nSalesperson: Hi Ms. Davis, I hope I'm not catching you at a bad time. I'm reaching out because I noticed your company recently expanded its operations, and I wanted to discuss how our cloud-based project management software could help streamline your processes. Do you have a few minutes to chat?\n\nMs. Davis: I suppose I can spare a few minutes. What exactly does your software do?\n\nSalesperson: Thank you for your time, Ms. Davis. Our software, CloudProject, is designed to help businesses like yours manage complex projects more efficiently. It offers real-time collaboration, resource allocation, and progress tracking all in one platform. Can you tell me a bit about how your team currently manages projects?\n\nMs. Davis: We're using a combination of spreadsheets and email right now. It works, but it's not ideal, especially with our recent growth.\n\nSalesperson: I see. Many of our clients were in a similar position before switching to CloudProject. What would you say are the biggest challenges you're facing with your current system?\n\nMs. Davis: Well, it's becoming increasingly difficult to keep everyone on the same page. We're wasting time in meetings just trying to figure out who's doing what and what's been completed.\n\nSalesperson: That's a common issue, and it's exactly the kind of problem CloudProject is designed to solve. Our platform provides a central hub where all team members can see task assignments, deadlines, and progress in real-time. How do you think that kind of visibility would impact your team's productivity?\n\nMs. Davis: It could certainly help reduce some of the confusion we're experiencing. How difficult is it to implement and train staff on using it?\n\nSalesperson: Great question. We pride ourselves on making the transition as smooth as possible. We offer a comprehensive onboarding process, including personalized training sessions for your team. Most of our clients find that their teams are up and running comfortably within a week. Would you be interested in seeing a demo of how CloudProject works?\n\nMs. Davis: A demo could be helpful. When could we do that?\n\nSalesperson: I'd be happy to set that up for you. I have some availability tomorrow afternoon or Friday morning. Which would work better for you?\n\nMs. Davis: Friday morning would be preferable.\n\nSalesperson: Excellent. How does 10 AM on Friday sound? I can send you a calendar invite with a link to our video conference platform.\n\nMs. Davis: 10 AM Friday works for me.\n\nSalesperson: Perfect, I'll send that invite right over. Before we wrap up, do you have any other questions about CloudProject or our company?\n\nMs. Davis: Not at the moment, but I'm sure I'll have some during the demo.\n\nSalesperson: Of course. I'll make sure to leave plenty of time for questions during our session. Thank you so much for your time today, Ms. Davis. I'm looking forward to showing you how CloudProject can help streamline your operations on Friday.\n\nMs. Davis: Thank you, Emily. I'll see you then.\n\nSalesperson: Great, have a wonderful rest of your day!"""
"1724606085874-2714","""Sarah: Good morning! Welcome to Harmony Haven Piano Gallery. I'm Sarah. How can I assist you today? Michael: Good morning, Sarah. I'm Michael. I've been thinking about purchasing a piano for my home. Sarah: That's wonderful, Michael! There's nothing quite like having a piano in your home. May I ask if you're a player yourself or if this is for someone else in the family? Michael: It's primarily for me. I used to play years ago and I'm looking to get back into it. Sarah: How exciting! Rediscovering a passion for music is always a joy. Do you have any particular style or brand in mind? Michael: To be honest, I'm not entirely sure. It's been a while since I've kept up with piano brands. I'm looking for something that would suit an intermediate player. Sarah: I understand. We have several excellent options for intermediate players. Would you prefer an upright or a grand piano? Michael: I think an upright would be more suitable for my space. Sarah: Great choice. Uprights are perfect for home use. Let me show you a few models that I think you might like. This first one is a Yamaha U1 - it's very popular among intermediate players. Michael: It looks beautiful. How does it sound? Sarah: Why don't you give it a try? Please, sit down and play a bit. (Sound of Michael playing a short melody) Michael: Wow, that feels nice. The keys have a good weight to them. Sarah: Yes, Yamaha is known for their excellent key action. How about we look at a few more? I'd like you to experience the differences in touch and sound. Michael: That sounds great. What else do you recommend? Sarah: Let's try this Kawai K-300. It has a slightly different feel and a warmer tone. (Sound of Michael playing the same melody on the Kawai) Michael: Interesting. You're right, it does sound warmer. Sarah: Indeed. Now, may I ask about your budget? That can help us narrow down the options. Michael: I'm thinking somewhere in the $5,000 to $8,000 range. Sarah: Perfect. Both of these models fall within that range. We also have some excellent used pianos that offer great value. Would you be interested in seeing a few of those? Michael: Sure, that could be a good option. Sarah: Excellent. While we walk over to that section, can you tell me a bit about your playing goals? Are you looking to perform, or is this mainly for personal enjoyment? Michael: Mainly personal enjoyment, but I might want to play for friends and family occasionally. Sarah: That's lovely. Music really brings people together. Here's a gently used Steinway upright. It's a few years old but in excellent condition. (Sound of Michael playing) Michael: This one has a really rich sound. Sarah: It does, doesn't it? Steinway is renowned for their tonal quality. Now, all of our used pianos come with a 5-year warranty, and we offer tuning services as well. Michael: That's good to know. Do you offer delivery and installation? Sarah: Absolutely. We have a team of experienced movers who will deliver and set up the piano in your home. We also do the first tuning after it's settled in your space. Michael: That's great. I have to say, I'm torn between the Yamaha and this Steinway. Sarah: That's completely understandable. They're both excellent instruments. Would you like to play them again, perhaps try a different piece of music? Michael: Yes, I think that would help. Sarah: Wonderful. Take your time. I'm here to answer any questions you might have about the instruments, our policies, or anything else. Michael: Thank you, Sarah. I appreciate your patience and expertise. Sarah: It's my pleasure, Michael. Finding the right piano is an important decision, and I'm here to help you make the best choice for your needs and preferences. (The conversation continues with Michael trying out both pianos again, asking more detailed questions about maintenance, resale value, and financing options. Sarah provides informative answers and gently guides Michael towards making a decision, ending with scheduling a follow-up appointment for Michael to bring his family to see and hear the pianos.)"""
